Reply,Upvote,Time,Key
"Its Euro. -> 280€ new.

If you want to test it -> start ""Recorder"" App, start recording and tap on the bottom and top microfone. If you hear the taps on both sides -> it records with both microphones.

EDIT: I found a reddit post from users using the oneplus 7 and they have the same issues with using the top microphones aswell in whatsapp, facebook, camera etc. maybe this is an issue with android 10. Urgh. Now we can wait for android 11?

&#x200B;

Yeah I had the problems after I patched back via PC ""HiSuite"" Software to 10.0. Maybe there was a bug in the software. Idk.

Now with the update on 10.1 everything works fine. No lags, wlan is fine, gps fine etc.

&#x200B;

Why outdated technology?",1.0,2020-08-23 10:34:38,760.0
"I tried using WhatsApp, Recorder and Camera Video to test top and bottom microphone. It works fine.

I'm glad you have most of the stuff resolved. This is a pretty good phone for the price.

Idk if its a bug.. Are you on 10.1.0.299? Perhaps its android issue 

Voicemail is no longer so actively used since its a hassle to dial back to telco voice inbox to check new voice messages. Overtime it just became less popular, and people are using social media apps to leave persistent voice messages instead. My bet is that it'll soon diminish to the void. Same on your end?",1.0,2020-08-23 18:02:57,760.0
"Yeah on Camera App or Recorder the sound of the mics are nice but in Whatsapp it's a bit ""muffled"" .. I don't know if this is the right word for it. Maybe it is just Whatsapp because they need to save space or something like that.

I'm on 10.1.0.225 with 1st June security patch.

What do you mean with voicemail?",1.0,2020-08-24 15:35:21,760.0
"I believe whatsapp do compressions on images, audio and videos.

Not sure if you have used voicemail before, that's how we call it in our region. It's the function from telco that allows you to leave a voice message at the end of the call.",1.0,2020-08-25 17:41:54,760.0
"Yeah, Whatsapp compressing the files very heavy. For example screenrecordings are absolutly fine in your gallery but when you send it in whatsapp ... it is very blurry. So I guess it is the same with the audio quality.  


Nope I never used voicemail. 

Another question: How often do you charge your nova 5t?   
I need to charge it like every 20 hours. My battery drains a lot (maybe because of Pokemon Go ...) and GPS always on. Hm..",1.0,2020-08-25 22:39:18,760.0
"Every 20 hours is great! I charge very often, the screen on time is better than OnePlus phones and battery depletes at a rate better than my past android phones. I do have a complain tho, the battery could deplete faster if u are using the phone heavily including gaming..",1.0,2020-08-25 23:23:51,760.0
"I'm at 6hours+ screen on time actually I guess.

But maybe I contact amazon because my power button/fingerprint is very sharp edged on the sides + the same in the side of the phone.

I don't know if ""sharp edged"" is the right word for it. But it is sharp when you go with your finger on it",1.0,2020-08-25 23:54:24,760.0
Yeah u could ask them. I didnt feel mine is that bad since I have a case....,1.0,2020-08-26 00:21:09,760.0
"But was it sharp when you got ur nova 5t? I'm chatting tomorrow with amazon, we'll see what they're saying",1.0,2020-08-26 09:55:28,760.0
Nope it wasn't.,1.0,2020-08-26 17:16:22,760.0
I think you just answered your own question.,1.0,2020-08-22 13:42:58,761.0
I was complaining about that here since the new feature hit emui 10.,1.0,2020-08-23 00:49:56,761.0
????,1.0,2020-08-22 13:49:15,761.0
"I think I figured it out, if you go onto Pro mode and video it doesn't automatically switch lenses (I have a p30, maybe its different for others).",1.0,2020-08-23 02:39:54,761.0
The source:  [https://www.youtube.com/watch?v=DWqHqACYchc](https://www.youtube.com/watch?v=DWqHqACYchc),1.0,2020-08-22 03:06:30,762.0
Just go to the Huawei service center and let them have a look.,1.0,2020-08-22 09:02:48,763.0
9hrs SOT yesterday,2.0,2020-08-22 09:02:49,764.0
"I probably get about 7. But I had a little top up earlier.
Usually from a 8am start, get about 20% by around 9pm. I'm a medium - light user.",1.0,2020-08-22 07:48:39,764.0
The Battery Optimizer takes a while to reset and settle down. Give it a few days and it will be back to normal.,1.0,2020-08-22 10:30:42,764.0
See the comment above.,1.0,2020-08-22 10:31:59,764.0
"I updated it about 2 weeks ago, so I don't think that's the issue",1.0,2020-08-23 00:08:52,764.0
Heavier usage today. Just done 12½hrs with 5% and 8:10hrs SOT.,1.0,2020-08-23 09:51:38,764.0
"Your phone is likely faulty then. I have 3 nova 5t at this place, all works well.",1.0,2020-08-22 10:07:20,765.0
"Go to your support app, and run Smart Diagnosis. 

Then... Have you tried a Factory reset?",1.0,2020-08-22 10:38:43,765.0
Do you have a voice mail waiting?,1.0,2020-08-22 03:48:28,768.0
"I know, it makes you want to put it in a jar of water, and fix it for good. Even when it's off, now that is really weird. Email Huawei support, and tell them what's going on, this is a deeper problem only they can solve. Hopefully it is not something that'll make you feel really small. But post what happens here, so we'll all know.",1.0,2020-08-22 04:00:16,768.0
ERecovery? It's radical.,1.0,2020-08-22 04:11:31,768.0
"No I don't. I already checked that.
Seems weird, since it's still on when I power the device off",1.0,2020-08-22 03:50:47,768.0
Support just told me to do a cache partition wipe. Didn't help and now support is closed.,1.0,2020-08-22 04:04:31,768.0
"ERecovery? Before that, I'm thinking that you should shut it down, and start charging, the light stays on for that?  Then quit charging after awhile, and then reboot. I'm thinking that one of the very small chips has experienced a glitch. What other things make that light come on? Data connection? Headphones plugged in? Is there an app that helps you control your TY? Stuff like that.",1.0,2020-08-22 04:18:19,768.0
You could use nail polish to turn it into a real cool color.,1.0,2020-08-22 04:21:28,768.0
"I tried to connect to my PC.
Charge while the device was both on and turned off.
Tried the different apps. Even removed some and redownloaded some. The light changed while charging from green to yellow (was at 75%) 
Then back to green when I plugged it out.",1.0,2020-08-22 04:56:33,768.0
Wow nice photo keep it up!,3.0,2020-08-21 06:01:49,769.0
"Damn, amazing!",3.0,2020-08-21 07:51:10,769.0
Dam that looks good!,3.0,2020-08-21 21:38:50,769.0
"If you go to settings/about phone and tap om the build number several times, it will go into developer mode.

Bac out to settings, an click on system and updates, scroll down to Developer options.

Be very careful in there, that's where you might find what your looking for.",1.0,2020-08-22 05:02:15,772.0
"I wonder if your mic is maybe plugged with dirt or dust. It's a really tiny hole at the base of your phone usually. I had it once that my colleagues couldn't hear me but I could hear them and this was the case. I took a toothpick and put it through the hole. Solved it

The massive echo doesn't make sense to me, unless you do some kind of direct feedback thing like when you have two microphones on at the same time.... Like in a zoom call where your computer and your conf room audio system are connected at the same time",1.0,2020-09-07 17:21:27,774.0
"I had it fixed, the company claimed it wasn't their fault, but it's most likely they hit the speaker module somehow when putting in my new screen module, I heard there's a very small membrane that's very sensitive and that will cause exactly these kinds of problems if you hit it.",1.0,2020-09-07 18:45:43,774.0
"Did you cleared cache in recovery, after updating?",1.0,2020-08-22 01:43:25,775.0
It's a common issue with chrome on the p30 pro. Not sure of there is a fix though.,1.0,2020-08-22 02:03:43,775.0
"Try the internet with the duckduckgo App, Chrome snoops so much it's creepy.",0.0,2020-08-22 05:24:02,775.0
"P30 pro isn't affected by google ban.
Grab it, it's a great phone!",3.0,2020-08-22 01:55:31,776.0
"Revolut doesn't have NFC support. You can use it with NFC only if Google Pay is available in your country.  


I was in the same situation two months ago when I brought P30 Pro. It's still a great phone which receives monthly updates (two security updates already), at least for now.",1.0,2020-08-22 02:27:09,776.0
"Yep, old and new version of P30 Pro have google services and Huawei just confirmed they will still have updates (not sure about new version of android but at least security, current EMUI Version 10.1 based on Android 10) even if the temporary license has expired.",1.0,2020-08-22 03:51:22,776.0
"Sorry, i meant that due to safety net(?) or something called like that that banking apps wouldnt work now that the license has expired",1.0,2020-08-22 06:21:11,776.0
P30 Pro is not affected. At least not with the current EMUI10.1.,1.0,2020-08-22 20:17:15,776.0
"Nice!
I should start putting clothes on at home. Haha",22.0,2020-08-20 21:21:17,777.0
I closed my curtains after this,10.0,2020-08-20 22:09:31,777.0
"bro, this is serious progress.",5.0,2020-08-20 22:19:06,777.0
The outdated espionage system. I wonder what they are using now.,4.0,2020-08-21 03:17:17,777.0
Kinda scary,2.0,2020-08-20 21:42:51,777.0
Wow,1.0,2020-08-20 22:10:13,777.0
P40 Pro or the Pro Plus?,1.0,2020-08-21 05:05:21,777.0
"If you go through these photos in the other direction and scream ""enhance!"" You feel like you're in a 90's movie",1.0,2020-08-21 05:26:58,777.0
"   
Awesome zoom! Progress does not stand still.",1.0,2020-08-21 10:54:46,777.0
Nice! Sydney ❤️,1.0,2020-08-21 15:54:56,777.0
Wow! Awesome. I think my 3x telephoto in mate 30 pro couldn't do so well.,1.0,2020-08-23 22:40:31,777.0
Every stalker upvitrd this,1.0,2020-08-27 17:58:39,777.0
"It's more of a gimmick than actually useful tbh. Cool to show off, but not actually that useful as the quality is too low. Still amazing that it can be done none the less",-1.0,2020-08-21 01:50:41,777.0
The new firmware improve a lot the quality!,6.0,2020-08-20 22:32:38,777.0
LMAO,3.0,2020-08-21 05:09:05,777.0
"Hello, It Is the Pro not the Pro Plus.
I noted that improvement after the last firmware update.
Take also in mind it was on my hand.",1.0,2020-08-21 05:06:30,777.0
For sure the next step could be the application of post processing engine for object recognition and sharpening. Like the Topaz tools,1.0,2020-08-21 05:28:20,777.0
I do agree 😆,1.0,2020-08-28 05:57:22,777.0
"You can clearly read the text... And take in mind it was on my hand without any stabilisation.
I think it is a very great result.",3.0,2020-08-21 05:08:44,777.0
4 out of 5 photos are great quality. I think the final zoom use case is very much dependent on what you need to capture.,1.0,2020-08-21 02:11:28,777.0
"Thanks, I needed to make sure, I'm impressed by the quality, I thought you forgot to add the 'Plus' to your title.",1.0,2020-08-21 05:09:21,777.0
"I'd like to get the Plus but in Australia the price is as my topic, insane, and no trade for the upgrade.
Selling now a Huawei mobile for 2nd hand unit with the ""scary"" matter of the ban is very bad",1.0,2020-08-21 05:11:13,777.0
"Sure, and it's hard to wonder how much better may the Plus be compared to this. I'll still hold my Mate 30 Pro for a while.",1.0,2020-08-21 06:56:15,777.0
Mate 30 Pro I have too :) I have the 5G Edition and it is my primary phone. I love its design it is superb.,2.0,2020-08-21 08:20:13,777.0
"emui 11 is not out

the latest is 10.1

root isnt possible on huawei devices as you cant unlock the bootloader 

have you tried the hisuite to see if there is an update available?

 [https://forum.xda-developers.com/huawei-p30-pro/how-to/guide-how-to-flash-approved-fullota-zip-t4112775](https://forum.xda-developers.com/huawei-p30-pro/how-to/guide-how-to-flash-approved-fullota-zip-t4112775)  you could try this as well",1.0,2020-08-22 00:13:49,778.0
EMUI11 will be realease to the Mate 20 Pro. (Normally),1.0,2020-08-22 01:51:30,778.0
"What region are you in, sometimes buying another carriers track phone card can do the trick",1.0,2020-09-02 20:14:49,778.0
"Try clearing the Partition Cache. Then use update through both settings, and the support app.

Do not try to Flash any OS... your phone might not be able to pick up the cell phone frequencies in your country.

If you really think that you've been singled out, because you are special, look up eRecovery.

But backup all your data first.",0.0,2020-08-22 00:21:55,778.0
"Try deleting Snapchat, and reinstalling the latest version. Clear Cache first.",1.0,2020-08-22 00:25:34,779.0
"Contact Huawei support. Hope it works out for you, because that sucks.",1.0,2020-08-22 01:13:27,779.0
Doesnt work. I tried in safe mode to see if it was any of the apps but it still didnt work,1.0,2020-08-22 01:11:27,779.0
"You could order a new screen, there are plenty of YouTube videos that will show you exactly how to replace it yourself.",1.0,2020-08-22 00:29:27,780.0
".

Shutdown the phone, Hold down the volume up key, press the and hold the power button til the logo appears. Use the up and down volume keys to navigate, and the power button to make your selection.

[new Edit] Select clear Cache Partition, this is found in the clear data menu.

Try Safe mode first, to get access to your data, and back it up.

Then try Factory reset. You can try it, but it will probably just re-install your problem. 

If that doesn't work, Check out ERecovery at Huawei's support pages. The problem is, unless you pulled regular backups, unless you can somehow get a computer to communicate with it, you just lost all your data",1.0,2020-08-21 23:05:04,781.0
See my edit..,1.0,2020-08-21 23:18:10,781.0
looks great,2.0,2020-08-22 17:17:37,782.0
Thank you!,1.0,2020-08-22 19:09:50,782.0
Yeah from Quick App Center is way easier and more efficient to use.,1.0,2020-08-21 21:32:15,783.0
"What is the issie with Uber Eats for example. I have an Mate 30 Pro and Mate Xs and it works
Only issue I noticed is the map missing when ordering and waiting for arrival. 
I have microG installed but in the vanced version as I need it for youtube vanced and cannot install the normal microg version to try out",1.0,2020-08-21 22:18:44,783.0
"I still prefer the real app, but it doesn't work on the P40.",1.0,2020-08-21 21:35:04,783.0
"Do you have GMS installed? This is for P40 users, people who don't have GMS.",1.0,2020-08-21 23:42:26,783.0
"Still use the one from Quick App, it's good as the app.",1.0,2020-08-21 21:36:50,783.0
No. I don't,1.0,2020-08-22 11:27:47,783.0
Oh ok. But if Uber Eats works fine I would like to know where you downloaded it from,1.0,2020-08-22 11:58:15,783.0
Aurora Store,1.0,2020-08-22 13:24:56,783.0
"I tried it right now and it's unusable, the maps don't work so you can't order anything. The point that I made in the post still stands.",1.0,2020-08-22 20:56:21,783.0
I am talking about uber eats. Yeah map does not work. But you can order food. You don't need the map,1.0,2020-08-22 20:58:01,783.0
"Didn't know about Uber Eats because I didn't test it before. But since uber didn't work I thought that Uber Eats worked the same way. The way that I showed in the post is still the better way, the full app works on both Uber apps.",1.0,2020-08-22 21:22:09,783.0
"Introducing /r/Honor, with HONOR help and official giveaways! Hey there Friend, thanks for your attention on HONOR products. Feel free to Post News, Submit photos, Start discussions, Ask for help, and Participate in the Giveaways.!

*I am a bot, and this action was performed automatically. Please [contact the moderators of this subreddit](/message/compose/?to=/r/Huawei) if you have any questions or concerns.*",1.0,2020-08-21 21:01:16,784.0
"Introducing /r/Honor, with HONOR help and official giveaways! Hey there Friend, thanks for your attention on HONOR products. Feel free to Post News, Submit photos, Start discussions, Ask for help, and Participate in the Giveaways.!

*I am a bot, and this action was performed automatically. Please [contact the moderators of this subreddit](/message/compose/?to=/r/Huawei) if you have any questions or concerns.*",1.0,2020-08-21 21:01:16,784.0
"I had the lite version, and with only 3 gigs of ram, I can't say I had your issues, because I was very careful about apps loading on startup, and others running in the background.

I did tire of apps I was using closing when I returned from another task. But the OS and especially the Apps get larger, larger with every update, and soon the ability of the phone to cope becomes very clear.

I upgraded to 6 gigs, and it is so fast, I never knew what I was missing. Hope this helps.",1.0,2020-08-21 22:23:03,784.0
So the only way to fix it is to buy a newer Huawei phone lmao,1.0,2020-08-21 22:27:13,784.0
"You can, clear Partition Cache (see the support pages), stop apps from loading on startup, prevent apps from running in the background, (install Android Optimizer for all that).",1.0,2020-08-22 01:18:16,784.0
"Got a security update 4am this morning (10.0.0.171), last one probably.",5.0,2020-08-21 21:50:32,785.0
"This person who wrote the article is not as up to date or tech savvy as they think. 2 issues here..

1, OS upgrades, not all the phones had the AI capability to receive the programming in the new EMUI, so the're out of luck.

2' Security updates are 'open source,' and although Google provides them, Google did not make them in the fist place. Huawei continues to get them from the Android community, just like any other patch.",3.0,2020-08-21 22:34:38,785.0
"**I found links in your comment that were not hyperlinked:**

* [10.0.0.171](https://10.0.0.171)

*I did the honors for you.*

***

^[delete](https://www.reddit.com/message/compose?to=%2Fu%2FLinkifyBot&subject=delete%20g2b75rk&message=Click%20the%20send%20button%20to%20delete%20the%20false%20positive.) ^| ^[information](https://np.reddit.com/u/LinkifyBot/comments/gkkf7p) ^| ^<3",0.0,2020-08-21 21:50:53,785.0
"Well I'm up-to-date and this dilemma as to security updates has been ongoing for quite some time, seesawing back and fourth. Again just heard last week they will get them then in this article, nope.

Then there's my P20 & P20 Pro that's yet to receive EMUI 10, still on January's patch and only acquiring 12 total patches since launch.

So who am I going to believe? Well proof is in the pudding saying this article is more on the reality side, if my experience is any indication.",2.0,2020-08-22 03:23:31,785.0
[https://developer.huawei.com/consumer/en/hms/huawei-audiokit](https://developer.huawei.com/consumer/en/hms/huawei-audiokit),1.0,2020-08-21 18:36:51,787.0
"There is a solution, but I can't remember it right now. I'll let you know if I do",1.0,2020-08-21 18:58:44,788.0
"Finally I found the problem

SOLUTION: If the beauty filter is on, you can only make videos in 720p. Pull the ""beauty"" knob to zero",1.0,2020-08-22 08:59:02,788.0
Older models will work fine and will have android and google services like the p30 or mate 20 series. Newer models will have the huawei os and will be affected by the ban. Please check the device OS prior to buying.,1.0,2020-08-21 09:33:51,791.0
"Yes, that's correct, basically devices before P30 Pro will have Google services, devices after that model have Huawei own app store and don't have Google services or Google App Store.",1.0,2020-08-21 10:21:46,791.0
"Newer models still have android.  Android os is open source and anyone can use it.  The proplem is the us has band companies form doing business so they can't use Google's mobile services play story. That sort of stuff. So phones like the p40 mate 40. Will have android. But will come with HMS Huawei mobile services  and Huawei  app store..  if the us ever lifts the ban Huawei has said will update phones


But as there mobile services grows there dependace I n Google disappears.   It's has really done more damage to google than Huawei.",2.0,2020-08-21 16:06:11,791.0
Some pixels are flickering while the always on display is on. Do anyone have the same problem?,1.0,2020-08-21 09:27:37,792.0
The issue is not very clear in the video. Did you try changing watch faces and see?,1.0,2020-08-21 09:36:42,792.0
EMUI?,1.0,2020-08-21 08:32:10,793.0
"Ah, sorry. Screen shot of what you want removed. You'll have to delete this whole post, and post a new one.",1.0,2020-08-21 09:10:04,793.0
"Is there such an option? I have a glass protector on the screen of my Mate 20 Pro, and it has a black border at the curve, so I can't see through the glass there. I'd also like an option for the screen to stop drawing at the edge before the curve.",1.0,2020-08-21 15:51:26,793.0
10.1.0.140,1.0,2020-08-21 08:35:07,793.0
"The display is curved, so when I open a photo, it gets displayed along the curve, I would prefer it not to, but to stop at the edge.",1.0,2020-08-21 09:30:06,793.0
"Can you (delete, and re) post a screenshot?",1.0,2020-08-21 08:40:14,793.0
"Oh. You want a border around the edge. I have the same EMUI as you, and I just ran through my settings menu, and can't find a thing too.",1.0,2020-08-21 09:43:56,793.0
A screenshot of what? the settings?,1.0,2020-08-21 08:50:49,793.0
"Go to settings/apps/apps, find the 2 or three things that in uses, shut them down, and change the permissions of all 3, to block data + WiFi communications.",1.0,2020-08-21 04:49:18,794.0
"This should give you some peace of mind.

[Click here... ](https://www.huaweicentral.com/huawei-emui-receives-british-standards-institution-privacy-protection-certificate-may-2020/)",1.0,2020-08-21 04:52:10,794.0
Try shaking your fist at it.,1.0,2020-08-21 05:59:13,794.0
AI search is the search bar that appears when you swipe down? I disabled it trough ADB.,1.0,2020-08-21 20:55:06,794.0
"The only useful comment, thank you",1.0,2020-08-21 09:52:13,794.0
I did but it's not working!,1.0,2020-08-21 09:42:42,794.0
"Exactly, I use this feature to search for apps only and I don't want it for anything else. ADB requires root access, right? Because that's unfortunately not possible on the P30 Pro.",1.0,2020-08-21 22:15:47,794.0
No. It doesn't require any root because I did it on my P40 Lite. I used this method to also remove some more bloatware like Huawei Music and Huawei Video. Replaced with BlackShark and VLC.,1.0,2020-08-21 23:39:58,794.0
"I'll look into this, thanks for your help",1.0,2020-08-22 00:35:07,794.0
"Here is a list of the stuff that you can remove: [https://forum.xda-developers.com/huawei-p40-pro/how-to/adb-debloating-t4088633](https://forum.xda-developers.com/huawei-p40-pro/how-to/adb-debloating-t4088633)

I only removed some, most of them are fine and great to keep and use.

Also a heads up, if the ADB prompt doesn't accept your command, try using `./adb` instead of only using `adb`.",1.0,2020-08-22 01:16:50,794.0
"Truly like this tablet. And after owning it. You really don't need the Google play store, when you have the Aurora store. It got everything. Every single app you can find on the play store. Happy with the purchase and it's so smooth. The processor gives it a great experience.",15.0,2020-08-20 06:21:33,795.0
Which icon pack is that?,6.0,2020-08-20 08:11:07,795.0
Icon pack?,3.0,2020-08-20 14:52:35,795.0
"Loving my Matepad Pro, fantastic device",2.0,2020-08-20 14:31:36,795.0
What headphones are these?,1.0,2020-08-20 14:14:32,795.0
"Awesome!
If you were also using the matepen, could you also share some of your thoughts?",1.0,2020-08-20 21:24:16,795.0
"There's only one thing it and 99% of tablets lack, Oled. I'll wait.",1.0,2020-08-20 09:42:54,795.0
Same exact experience here.,2.0,2020-08-20 06:42:56,795.0
Can you sign in on youtube app without google services?,1.0,2020-08-24 09:54:37,795.0
It is. Best Android tablet for an insane low price.,2.0,2020-08-21 03:32:33,795.0
Don't have it.,1.0,2020-08-21 03:31:55,795.0
Lol' don't want OLED on a tablet. Watching Twitch on an an OLED screen will definelty give you a screen with burn ins.,1.0,2020-08-21 03:34:18,795.0
s7+ is right around the corner,1.0,2020-08-20 10:44:42,795.0
"
Great tablet it is.",3.0,2020-08-20 07:10:45,795.0
That's where YouTube Vanced is for.,1.0,2020-08-24 10:35:44,795.0
"I'm sorry, for me I'm all about dark mode on everything because it feels easier on my eyes. Oled does it infinitly better that others.

Edit:
Spelling correction.",1.0,2020-08-21 03:37:00,795.0
"I know, I keep up to date almost daily on smartphones and tablets. However, that lacks wireless charging. Not too much of a complaint if it wasn't for the extortion of a price.",1.0,2020-08-20 10:48:07,795.0
"Really? Last time I used Vanced, it won't let you sign in without root. Although too late for me now since I've been using premium. Anything Vanced has that official app doesn't have?",1.0,2020-08-24 11:01:30,795.0
How do u intend to wireless charge a big piece of brick?,3.0,2020-08-20 13:28:07,795.0
Matepad Pro can do it.,1.0,2020-08-21 00:18:06,795.0
"Is the back of the case bulging slightly? This is caused by your battery swelling, and should not be ignored as it can damage other things or catch fire.",1.0,2020-08-21 08:02:33,796.0
"One cause could be pressure building up from behind, and pushing on the screen. Keep an eye on that. I'm out of ideas ☹️.

Great job taking and posting the pictures!",1.0,2020-08-21 08:11:17,796.0
"That was good to hear, my bad because I should have thought of that. You don't need to put it in rice, just keep it warm (not hot!) & dry, and in time it will go away.",1.0,2020-08-22 10:42:18,796.0
"No, the back glass panel is completely straight and normal. Are you sure its the battery swelling issue? If so what can be done to fix it?",1.0,2020-08-21 08:05:41,796.0
