Reply,Upvote,Time,Key
"Believe Huawei only provides a 1-letter upgrade for their ""Lite"" models. P20 Lite is in similar boat and won't receive EMUI 10.",2.0,2020-09-07 06:52:36,250.0
Settings/homescreen & wallpaper,0.0,2020-09-08 00:24:49,251.0
"And then? What I want to change the main screen (the default home screen or page, not the image) to an empty one",1.0,2020-09-09 05:11:42,251.0
I've been using them for like 5 months now and I havent noticed any delay while watching or playing. The only delay I've noticed is when you lower the volume it takes a micro second for you to hear that change.,1.0,2020-09-07 06:31:52,253.0
Thank you!,1.0,2020-09-07 06:45:33,253.0
Nice photo!,1.0,2020-09-06 20:12:02,255.0
The list includes fishing ... basics jumps are fine i think,1.0,2020-09-07 03:54:38,257.0
"Sorry, edited, does it track jumprope.",1.0,2020-09-07 04:04:11,257.0
"There's not a specific mode for it, but it should track jumps as a workout since there are a large variety of niche sports",1.0,2020-09-07 04:09:12,257.0
Sadly it's true. I just bought a new one and it has done 3 updates so far. Each one was around 5MB and took more than an hour.,1.0,2020-09-09 01:47:39,258.0
Learn more :  [https://developer.huawei.com/consumer/en/quickApp](https://developer.huawei.com/consumer/en/quickApp),1.0,2020-09-06 22:46:43,260.0
Learn more :  [https://developer.huawei.com/consumer/en/hms/huawei-scenekit/](https://developer.huawei.com/consumer/en/hms/huawei-scenekit/),1.0,2020-09-06 22:34:29,261.0
"For a minute I thought they looked like they had a matte finish and i got excited. But the photos show all 3 colours just as shiny as everyone else's product.

HUAWEI, could we please try a subtle and classy matte finish instead of shiny and toylike? Thank you.",1.0,2020-09-06 19:46:12,262.0
Anyone know when these wil release in the UK?,1.0,2020-09-07 20:40:06,262.0
I love it.,2.0,2020-09-06 00:16:15,263.0
"Hey man, nice shot!",1.0,2020-09-05 23:47:01,263.0
"Amazing picture, congrats 👌",1.0,2020-09-06 01:46:55,263.0
"Woow, looks amazing. Btw I downloaded it and it is 16 MB. Is it taken in 50 MP?",1.0,2020-09-06 02:44:06,263.0
Thank you 🤳,1.0,2020-09-06 04:55:55,263.0
Thanks for your comment 🙄,1.0,2020-09-06 04:56:13,263.0
"Hello it's HDR, with HiRes you are unable to use the wide camera.",1.0,2020-09-06 04:57:03,263.0
"I'm not sure if they have any for the P30 like that, but Ringke definitely make cases with a port covers for other phones. Might be a good place to start.",1.0,2020-09-06 21:10:47,265.0
" [http://www.lovemeicase.com/index.php?route=product/product&product\_id=55505](http://www.lovemeicase.com/index.php?route=product/product&product_id=55505)   


Warning, they are HEAVY. have the same for my p20 pro.",1.0,2020-09-06 21:27:45,265.0
"Its called a bootloop. It happens when a) os error b)hardware malfunction c) huawei sent another security patch that deletes major boot codes by ""mistake"" 
SERVICE! PONEY UP THE MULA or if skillz suffice, wipe the OS.
(Not like other androids, huawei has a no bootloader policy since p10 coz they wana be apple... so Im wagering its service)",1.0,2020-09-06 18:35:10,266.0
"So basically, there’s no solution to this? The only one would’ve been wiping the OS, but it can’t be done... alright then i guess the only thing to do is to bring it for guarantee :(

Thanks",1.0,2020-09-07 04:16:37,266.0
Excellent,1.0,2020-09-06 19:56:53,268.0
Grazie!,1.0,2020-09-06 20:17:15,268.0
"Introducing /r/Honor, with HONOR help and official giveaways! Hey there Friend, thanks for your attention on HONOR products. Feel free to Post News, Submit photos, Start discussions, Ask for help, and Participate in the Giveaways.!

*I am a bot, and this action was performed automatically. Please [contact the moderators of this subreddit](/message/compose/?to=/r/Huawei) if you have any questions or concerns.*",1.0,2020-09-06 09:44:44,273.0
3 pictures and 3 smartphones... Who shooted what? 😝,1.0,2020-09-05 19:39:34,278.0
which model?,5.0,2020-09-05 06:06:52,282.0
Ryzen 4000?,3.0,2020-09-05 07:12:51,282.0
Wow! Enjoy your new Huawei Laptop! I'm jealous! Hope you love it!,3.0,2020-09-05 08:02:37,282.0
Niceeeeee,2.0,2020-09-05 06:18:54,282.0
Great Laptop enjoy it,2.0,2020-09-05 09:53:01,282.0
"Nice choice! My gf is plenty happy with her d15, it's one of the nicer built laptops for sure, super light and compact for being a 15"" for a very good price! It actually runs really cool and quiet too! Hope your happy with yours!",2.0,2020-09-05 10:24:45,282.0
It's the d 14 512gb 8gb version : ),4.0,2020-09-05 08:40:13,282.0
Amd ryzen 5 3500u,5.0,2020-09-05 08:46:23,282.0
Thanks bro 👌,1.0,2020-09-05 08:41:27,282.0
Thanks,1.0,2020-09-05 13:09:17,282.0
For sure 😁,1.0,2020-09-05 13:00:37,282.0
thought about getting it. but just bought the Honor Magicbook 15,2.0,2020-09-05 08:41:17,282.0
No Problem!,2.0,2020-09-05 08:43:58,282.0
I was considering that too,2.0,2020-09-05 08:45:48,282.0
why did you bought the d14 instead?,1.0,2020-09-05 08:47:47,282.0
"I wasn't sure about how much storage was on the magicbook but otherwise they are both the same, oh and u can add an extra internal hard drive.",1.0,2020-09-05 08:49:28,282.0
that's nice to know,2.0,2020-09-05 08:50:39,282.0
No Amber. Few weeks yet 😂,1.0,2020-09-05 19:12:32,285.0
This is an indica no amber please :),1.0,2020-09-06 02:41:21,285.0
If you go into the gesture navigation settings then there is an option to launch Google Assistant. Turn that off,1.0,2020-09-06 20:59:05,286.0
"Do you mean System navigation? I'd expect it to be there but I only have Gestures, Off-screen navigation key, Single-key navigation, Three-key navigation, and Navigation dock. 

Strangely, the problem has gone away. The only reason I can think of is that I changed between Gestures and Off-screen navigation a few times.",1.0,2020-09-07 01:31:00,286.0
Can it run autocad?,2.0,2020-09-05 18:59:36,287.0
"I don't use autocad since I'm in a business related course, sorry. But if it helps, the specs are: Ryzen 5 3500u; Vega 8 iGPU.",1.0,2020-09-05 22:31:47,287.0
Thankyouuu,2.0,2020-09-05 22:47:44,287.0
"Still a very high end phone with a huge battery life, amazing camera & display and blazingly fast. As it’s a year old it’s also cheap too. There really aren’t any drawbacks - had mine 4 months and love it.",5.0,2020-09-05 18:13:37,288.0
I know this is an huawei Subreddit but why not go for like a Oneplus flagship?,3.0,2020-09-05 18:23:27,288.0
Ive had my p30 pro over a year and it's still fantastic,2.0,2020-09-05 19:31:45,288.0
Yeah,1.0,2020-09-06 01:01:27,288.0
"Oneplus camera and back design it's not my cup of tea, also lack of support from third party stores where you can easily get a samsung/huawei/apple phone repaired or find a case/accessories.",2.0,2020-09-05 19:24:36,288.0
Camera,1.0,2020-09-05 18:41:59,288.0
"Yea same, got one of the best battery life performance",1.0,2020-09-06 04:15:37,288.0
Yeah but have you checked the Oneplus 8 pro specs. Literally everything else but the camera is better and its a newer phone. But if a camera is important to you go for the p30 pro.,1.0,2020-09-05 18:44:16,288.0
Oh you're not the op.. Well anyway i would go for the oneplus. Also the 120hz screen is amazing,1.0,2020-09-05 18:45:36,288.0
"Perhaps you have them stored in the cloud and not on your phone? Still seems inadequate: gallery should recognise that they're unavailable, and tell you.",1.0,2020-09-06 05:30:29,289.0
I'm pretty sure it's optimising it or something. I have that too,1.0,2020-09-06 20:59:50,289.0
Can help you by the end of this month when my galaxy watch arrives 😂,1.0,2020-09-06 01:08:22,290.0
"I uninstalled my Google Translate app, but the regular ""translate via google search"" remains. I don't want it to show up as an option when copy/pasting, how it is turned off?",1.0,2020-09-05 21:56:21,291.0
"Interesting. When I do that, I have the word DEFINE there.",1.0,2020-09-06 20:37:57,291.0
Yeah it changes sometimes. With some words it doesn't suggest either translation nor define.,1.0,2020-09-09 17:30:36,291.0
"I managed to enter recovery mode with a method shown by a website on the second page of Google.   
Cool design how the password just changes on you randomly one day.",1.0,2020-09-05 20:17:15,292.0
Daaamn. What site?,16.0,2020-09-04 08:57:16,295.0
Didn't even know it came in + size!,5.0,2020-09-04 15:50:23,295.0
Amazing. Congratz!,4.0,2020-09-04 17:44:44,295.0
You have in Serbia vacuum sealed for 650 euros tho.,4.0,2020-09-04 20:06:13,295.0
"Well besides that hudge scratch on the camera it looks amazing. Take care of it, and have fun with it",2.0,2020-09-04 19:12:44,295.0
"Is it white or is it just the cover? If it is white, I LOVE the color! Too bad, not many companies offering white color. I passed on to Samsung S20 after my P30 (regular) went to swimming in sea for about an hour (I know..stupid me!) and I LOVED my P30 even tho I hated some little glitches in Emui (nothing serious, for example in my recent apps, it was always displaying wrong apps and when I was clicking let's say whatsapp, it was opening an other app) it was one of the best phones I had ever owned (always owned flagship models).

Passed to Samsung because I always loved the One UI better for the customization possibilities (changing the accent color and icons of quick toggles without installing power share..etc) but still, I still love the Huawei phones and the only reason that I did not consider it was because of the Google ban. Not for the playstore apps, I can side load it..etc, but for me, not being able to use Bank Apps was a deal breaker. I saw that certain bank apps work and certain doesn't, but still, it was a gamble to take. I also don't like the big pill punch hole. I would have preferred a single punch hole.

Having said that, I miss certain camera modes of my Huawei, such as the Silky Water! It is an amazing mode! And I still think that on certain cases (many cases) Huawei takes better photos!! (I buy a phone for camera, screen (i dont like huge ones) and battery life). But on Night mode, which I enjoy taking photos, the RYYB sensor produced most of the times very yellow photos, which was fixable with post processing. Tho on portrait shots, in my opinion, Huawei P30 Pro wins hands down! I can only imagine that P40 pro would be even better! And in Selfie shots I prefer Samsung, even tho I am not a selfie guy, with Samsung, I realized that I started to take more selfies.

And to finish.. that battery life... that is something that I will miss A LOT! Well my regular S20 (Snapdragon - bought an import model) is not bad at all, I am at 57% right now with 21 hours of usage (just around 2 hours of screen on time) , which is not bad, but it is nowhere near my P30 (regular) with less battery capacity (4000 mah vs 3860 mah).

Sorry I went a bit off topic and made a comparison that no one asked! But when I saw that beautiful Huawei that you bought, it made me go nostalgic lol. Enjoy your phone in good health, you have one of the best and the most beautiful phone around right now!!",2.0,2020-09-04 20:18:28,295.0
👌,2.0,2020-09-04 21:53:40,295.0
I don’t think there are any +s in the US.  Huawei has really disappeared here.,2.0,2020-09-05 04:46:26,295.0
Enjoy mate. I have the Pro (not Pro+) and it's a great phone.,2.0,2020-09-05 15:38:32,295.0
"My only concern with this phone is the lack of clarity when it comes to whether all the apps I currently use will work well. Is there any way to check that? My concern is with banking apps, wallet apps, food delivery apps.",1.0,2020-09-06 01:06:42,295.0
[deleted],-18.0,2020-09-04 10:56:57,295.0
Local forums online that I read. Spotted this as new post and didn't think twice after having 2 P40 Pro's 😂,8.0,2020-09-04 08:59:18,295.0
Bought in the US?,3.0,2020-09-04 11:56:36,295.0
"Well it's not widely sold, not even here in Finland. Just P40 Pro models getting sold 😊 I def. can recommend this phone if you can get hands on one.",2.0,2020-09-04 18:35:51,295.0
Thanks m8 sometimes you get lucky even you don't except what's coming! 😄,3.0,2020-09-04 18:34:40,295.0
This was 490€ 😗 How there is so cheap? Is that Huawei P40 Pro Plus- model or normal PRO?,1.0,2020-09-04 20:08:45,295.0
There is not single scratch on this phone. Not even in the frame. I think you are looking at that light reflection as I used flashlight from the side to light this picture up.. 😂 but yeah thanks dude 😊,2.0,2020-09-04 19:21:06,295.0
All it needs is for USA to unblock them and they're back to being the best phone on market.,12.0,2020-09-04 12:37:55,295.0
I have myself Huawei Mediapad M6 10.8'' tablet with 4x Harman Kardon speakers. I have too Huawei Mate 20 X 4G true stereo speakers by Dolby Atmos. Then lastly Huawei P40 Pro Plus now and I could not be happier. I would be all good if my Mate 20 X did not support google as this what you wrote is BS. Huawei rules sales now and when this orange boy Trump gets kicked out Huawei sales will grow up more hugely than they did even without needing any google. People like me understands that it is maybe better to live without google and USA spying. It feels like their own eco-system. It feels like more freedom.,3.0,2020-09-04 19:30:11,295.0
Nice! Well congrats on the pickup,7.0,2020-09-04 08:59:55,295.0
That's crazy. Any idea why it was being sold? I'm jealous of you!,3.0,2020-09-04 13:56:44,295.0
where i live people selling their pro for cheap. so this doesn't surprise me. i think the annoyance on installing gapps kind of got people off guard since it can give crazy random errors. lmao,1.0,2020-09-04 20:33:34,295.0
It was bought in Finland. 😊 I haven't seen such a deal even on Ebay.,3.0,2020-09-04 18:33:44,295.0
I was going to upgrade my p30 pro to p40 pro but the front camera killed it for me. :(,2.0,2020-09-04 20:49:11,295.0
"Yeah, but it was used.
Im talking about sealed one.
And yeah, it was regular pro, not plus.
Btw, they have same specs, the plus is just bigger.",0.0,2020-09-04 23:09:10,295.0
"Oh, lmao I thought it was a scrach lmao",3.0,2020-09-04 19:25:54,295.0
"For me they still are, its just a shame that society (me including) is depending so much on American apps. Im kinda happy that Huawei is investing so much in their appgalery to try and get it on the same level.",8.0,2020-09-04 13:44:57,295.0
Thanks m8 I almost went to close 1000$ Sony RX 100 VA- compact camera but the sensor size gap is not so huge between these things anymore. 😁,7.0,2020-09-04 09:02:15,295.0
"Haha well ""thanks"" 😁 Yeah I was just reading this used phones forum online which is based here in Finland and I spotted this one as newly released there. I knew instantly what this exactly phone can offer and contacted him. He was selling this because he was the second owner (for two weeks 😁) and told me that he doesn't know how the warranty goes if the first owner sells it away. Aaand this basic no google reason. But anyways I'm happy with this purhace. Feels more premium than P40 Pro as this one has some ceramic.",5.0,2020-09-04 18:32:53,295.0
"Well, it's something that you should really think before even getting brand new Huawei device these days. It can be compared to apple's ecosystem and android's how they differ. Huawei is just beginning of making their ecosystem getting everything running perfectly. Meanwhile you can manually put your apps. I don't use at all apps that needs GMS running in background listening all the time your conversations in real life and giving ads by your interests like that way.",1.0,2020-09-04 20:52:54,295.0
"Like the design or quality? I'm getting some best shots ever with this specific selfie camera because it has eye tracking autofocus system built in. The ""pill"" size is big because there is some high end tech built in like IR- face detection and autofocus system.. it doesn't bother me at all tho but people has their own tastes. :)",1.0,2020-09-04 20:55:32,295.0
"Actually they has a little difference, althought why the price gap is so huge then? Feels like Plus has better quality in image I don't know why If I compare pics I took with 2 P40 Pro's earlier. Plus has more GPS settings too (GNSS), better zoom capabilities, faster 40w reverse wireless charger compared Pro 27w, Ceramic back which is more premium. Plus is better than Pro",0.0,2020-09-05 00:20:05,295.0
I think you got hypnotized from this white ceramic back cover 😉 😂 but anyways this phone is steal at this price. Can't believe that I sold my P40 Pro for 100 usd more than I had this for such a condition..,2.0,2020-09-04 19:33:50,295.0
"I don't mind relying on American apps, I mind Trump taking bullshit decisions. I sure hope Biden amends it when he takes office.",4.0,2020-09-04 14:01:09,295.0
">Sony RX 100 VA

for 1000$ you can get decent ""used"" canon full frame camera ;) Maybe even with lens.",0.0,2020-09-04 11:02:23,295.0
Yea I know. But for most of us that rely on certain apps for work + mobile payments on store and whatnot it’s still a stretch. I love my p40pro but I hope they add bank apps soon in the Netherlands.,2.0,2020-09-04 20:54:29,295.0
The design. It catches my eye all the time. P30 teardrop is perfect for me.,3.0,2020-09-04 21:11:02,295.0
"I work at Huawei..
Trust me, only thing that is better, is 100x zoom.
Nothing more.",0.0,2020-09-05 07:35:19,295.0
It will interesting to see if Status Quo will apply.,3.0,2020-09-04 15:05:55,295.0
Yeah I know but my main goal was to get camera that can always carry with you and in your pocket. This P40 Pro Plus has some potential to fulfill my goal as the camera which is always with you + 10x Optical Zoom 😊,3.0,2020-09-04 18:37:15,295.0
Oh I see. But I think Huawei offers their own payment method for replacing google pay etc. My banking apps works just fine. It's all about their own developers that have to code those apps to work without having this trash google running everywhere in the background. 😛,1.0,2020-09-04 20:57:47,295.0
"I understand it's sort of an eye sore when first see it. But honestly I don't even notice it, I have as the phone for 3 months now. Your brain will just ignore it",3.0,2020-09-04 21:15:45,295.0
 It available in my country. Which is odd .,1.0,2020-09-04 20:58:54,295.0
I thought so with the first notch phones and the Samsung s10 plus but after months it still kept bugging me. Luckily I found my p30 pro and xiaomi is releasing an under the glass phone soon.,1.0,2020-09-04 23:41:14,295.0
"I had this happen to me a lot with my mate 20 pro, I just ended up factory resetting it everytime.",1.0,2020-09-05 11:51:58,296.0
"did you recover the old data? if so do you know how to without a backup cuz like I said, I dont recall if I have one",1.0,2020-09-05 11:55:28,296.0
"I did not, but most of my stuff was saved to google cloud photos minus about 50 pics roughly given I had to factory reset it about 8 times.",1.0,2020-09-05 18:36:02,296.0
The p30 pro still has and will keep Google services as it wasn't made when the ban occoured. Very good buy.,12.0,2020-09-05 02:10:58,297.0
"Love my p30 Pro, hands down best phone I've  had in sometime.

No issues with ""any"" Google services at all including updates (UK) my contract will be up in November so I'm weighing my options up what's next but sadly it won't be another Huawei due to ongoing sanctions",10.0,2020-09-05 01:43:11,297.0
Yeah.,3.0,2020-09-05 01:57:18,297.0
"I love it, had it since march and have gone from Android 9 to 10.1 now. Bear in mind that I have a VOG-L09 model, so updates take longer to get to me. 

Google services and apps work perfectly, and will continue to. 

The only thing I dislike is that it isn't a stock android experience, but that's only my personal preference after coming from a Nokia 7 plus",3.0,2020-09-05 02:28:30,297.0
Great phone even if it is last year P Series flagship.,3.0,2020-09-05 03:24:53,297.0
"Amazing buy especially at the prices of today.

\- Fantastic camera, still playing with bests of 2020 ( apart video camera and selfie, in my opinion on those parts there are better cameras.)

\- AMAZING battery life

\- Very fluid and fast

\- Screen to body ratio very similar to 2020 flagships! (may be samsung has the edge)

\- Fast charging, faster than S20 and S20+ series.

The only downside is that you may not receive many more major updates. I think that Android 11 may be the last major update if it comes to P30 pro.",2.0,2020-09-05 03:31:22,297.0
Its a great device! I have mine since the launch. Sadly i'm afraid its going to be my last huawei due to lack of google services on the newer devices.,2.0,2020-09-05 04:23:57,297.0
I have a few month old mint breathing crystal for sale if you are interested.,2.0,2020-09-05 04:48:26,297.0
"For 500-700€, it is. At 700€+ you can get some on-sale flagships from this year though.

It's definitely a good buy! Go for the 8GB RAM version, not the 6GB.",2.0,2020-09-05 05:10:03,297.0
"It's still a brilliant phone and will last you 2+ years fine.  No issues with GMS, still getting updates on the regular too.

The only thing I wish it had was wireless charging.",1.0,2020-09-05 04:37:45,297.0
I have the p30 lite and I'm very happy with it.,1.0,2020-09-05 05:43:34,297.0
"I have the basic p30 and its pretty awesome apart from some minor software problems(aggressive ram management, minor ui bugs).

Performance is great tho,psp emulator runs fine.",1.0,2020-09-05 06:04:07,297.0
"I just got a p30 pro last week on eBay with a hairline crack everything else mint for £175 and I honestly think it's better than all S10 range and iPhone 11 range , don't hesitate to pick one up on the cheap!",1.0,2020-09-05 06:12:21,297.0
"Worth mentioning the glass on the front screen sucks hard, so I would put a screen protector on it. My OnePlus 3 had 1 small micro-scratch after 3 years but this thing has about 20 after a year.

Shame they used some no name glass and not gorilla...",1.0,2020-09-05 09:35:49,297.0
"The Huawei P30 Pro device will not be affected by the 5G ban announcement (Just in case you ask)

I would also like to assure that the device is pre-installed with Google Mobile Services and this will also be unaffected by the recent announcements, and Google Services will still be available on the device. 

Other than that, I own one and it's the best device I have ever owned. Amazing camera, battery and layout",1.0,2020-09-05 10:09:40,297.0
"Nah, Huawei is kaput yo. I have p30lite and p20 pro and them android updates takes too long. It's basically a dead phone thanks to Trump.",1.0,2020-09-05 20:33:56,297.0
"P30 Pro is an awesome phone even right now. The only issue is G services, but there's workarounds if you really want the latest updates.",-2.0,2020-09-05 01:20:06,297.0
"It doesn't have any Google restrictions, but I would recommend A galaxy note 10",0.0,2020-09-05 04:14:46,297.0
"Its still a great phone! But I wouldn't buy it right now...in fact, not any Huawei right now.
As for the P30 Pro. Its already 1.5yrs old, not future proof with 5g etc and with the recent cut off from Google it may have the G services, but it wont receive newer updates. 
Sad story. 
Go for a Xiaomi or so.",-2.0,2020-09-05 01:11:30,297.0
In the same boat. Due an upgrade now. Not sure what to do. Don't  want an iPhone. Ever. Mi 10 pro is import only. P40 pro no Google. There is the p30 pro new edition. May go for a newer p30 pro.,3.0,2020-09-05 04:04:25,297.0
But it does have wireless charging!?,2.0,2020-09-05 10:13:57,297.0
Why is Google services an issue? And we are getting monthly updates. (Security),2.0,2020-09-05 03:53:09,297.0
Battery life though,1.0,2020-09-05 17:02:31,297.0
P30 pro new edition is brilliant. Plus I got a free GT2B watch with it at the time on promo,2.0,2020-09-05 06:00:24,297.0
Maybe samsung? Only if you are in the US,1.0,2020-09-05 16:16:10,297.0
"Google ended their relations with Huawei, the P40 has no Google apps at all. Eventually Google will seize sending updates to older phones when a major change comes to an app.",-1.0,2020-09-05 04:06:51,297.0
"4500 mAh is a great battery size, I have a Huawei Y7 prime 2019, and It has 4000 mAh and it lasts me throughout the day",1.0,2020-09-05 18:45:57,297.0
"Same phone, refined screen, smoother edges, more storage. I'd say more ram but my p30 pro has 8 gig as does the new edition.",1.0,2020-09-05 19:10:07,297.0
I had ten years with Samsung. Went from s8 plus to the p30 pro. It's the only phone I have never ever had any issues with.,1.0,2020-09-05 19:04:54,297.0
"That's the P40 bro, not the P30.",2.0,2020-09-05 04:15:37,297.0
"Yes that's what I said, support for the p30 will end eventually",-4.0,2020-09-05 04:20:43,297.0
"The P30 Pro devices is pre-installed with Google Mobile Services and this will also be unaffected by the recent announcements, and Google Services will still be available on the device. x ☺️",1.0,2020-09-05 14:10:58,297.0
Those sites are fake.,2.0,2020-09-05 07:47:31,298.0
"you cant install twrp or anything custom on huawei devices due to the locked bootloader

there are no roms packaged with gms as well however some were providing old hisuite backups as a method of getting them - not sure if thats patched now or still going",1.0,2020-09-05 09:22:37,298.0
theres  no devs for huawei.,1.0,2020-09-05 13:07:25,298.0
"Oh really, so bootloader can never be unlocked?",1.0,2020-09-05 07:50:56,298.0
A lot of people were hoping/expecting them to allow it when they lost their google license as way to get developers on board to help get them back but seems like huawei has ultimately devices against this - their issues have changed/piled on now anyway as US has now targeted the hardware side of the business,2.0,2020-09-05 09:24:14,298.0
