Reply,Upvote,Time,Key
" **\[MicroG Services\] GMS for all Huawei Devices running only HMS**

[https://www.reddit.com/r/Huawei/comments/i5fhkf/microg\_services\_gms\_for\_all\_huawei\_devices/?utm\_source=share&utm\_medium=web2x](https://www.reddit.com/r/Huawei/comments/i5fhkf/microg_services_gms_for_all_huawei_devices/?utm_source=share&utm_medium=web2x)",1.0,2020-08-13 15:10:37,0.0
Google Chrome ----> Firefox Focus,11.0,2020-05-29 01:47:12,0.0
"I use yandex disk in Belarus. Unlimited storage for photos (no image size quality compression), 10GB free storage for files (expandable) I already have 42 GB free thanks yandex promos. Onedrive works very well too.",8.0,2020-06-01 09:08:23,0.0
Waze works without Google Play services?,5.0,2020-05-29 08:39:25,0.0
"6. you and add a webapp of you tube my using your favorite browser and then and page to homescreen. works 100% huawei browser, chrome, etc etc",6.0,2020-05-29 00:40:56,0.0
"Google Drive - pCloud
Gmail - move to ProtonMail or Tutanota,
Google Maps - OsmAnd",3.0,2020-05-29 00:01:50,0.0
"This is one hell of a compromise for consumers. Can't believe the US government is ruining my good experience with Huawei. I don't even live there. I want to continue using this brand so badly, but this is too much for me. Much respect for putting this out for us though.",3.0,2020-08-20 10:53:04,0.0
I got Google mobile services to work on my P40 Pro using this tutorial - https://youtu.be/8sfJVGqM_5Q,4.0,2020-06-03 05:38:53,0.0
"Like the Huawei Browser, but there is no sync with the desktop.
About Huawei cloud, it's not easy to reach from the desktop.
Same for the photo's sync with Huawei.

For login with Huawei Id on the desktop you need to scan the QR code but it's to many clicks on the phone (need to go settings, click the profile, click scanner option)
Or is there a shorter way.",2.0,2020-05-29 02:09:17,0.0
"Really just want Google Pay! Or at the very least, Huawei Pay to work in my bank! 

Google Photos I use a lot. I've literally thousands of photos already stored, so it would be extremely useful to have it on a phone that takes such good photos.",2.0,2020-05-31 11:10:33,0.0
Does anyone having issues with using Microsoft Authenticator? It works just fine on my Matepad Pro. However  on my P40 Pro+ I can't log in on my MS account.,2.0,2020-07-19 09:47:36,0.0
The amazon app store and apkpure are great play store alternatives. Also MoreApps is a pretty neat time saver for installing apps,2.0,2020-07-20 06:49:49,0.0
Google Drive -> Mega.nz Cloud Server,2.0,2020-07-27 21:06:01,0.0
Youtube vanced for those who want YouTube.,2.0,2020-08-07 18:36:06,0.0
"Just wanted to add Microsoft Outlook as a Google Calendar and Gmail alternative. Excellent replacement, coming from someone who used both stock apps religiously.

Also haven't seen YouTube Music mentioned (I was the only one stupid enough to buy a P40 Pro while being a YouTube Music subscriber). YouTube Music mobile site on Firefox with the Background Play extension let's me stream music again (almost) like normal, just no downloads, forward/back navigation, or headphone controls.",2.0,2020-08-23 04:11:04,0.0
"Could anyone help me with a good alternative to Google Photos compatible with Huawei and iOS?
I would like to keep the photos and images synced between those two platforms but so far I haven't had luck with OneDrive.",2.0,2020-08-23 13:01:35,0.0
 Huawei AppGallery  best alternative for google play store in future.,2.0,2020-08-24 09:21:23,0.0
"The Russian equivalent to Google – Yandex – has most of the services I need, including maps, unlimited photo storage and a great keyboard. Only downside is that all my info is stored on Russian servers. 

Instead of Chrome I’m using Opera and the Aurora store has most of the apps I need. That way this phone is great as a secondary phone. If it was the only phone I had I probably would have played it safe with a Galaxy S20 though. There are a few really important banking apps as well as a couple of streaming services that just won’t run on this phone, so this is undeniably a problem for Huawei’s customers in the west.",1.0,2020-05-29 02:42:43,0.0
"Does OneDrive work? If so, that would be a good way of backing up photos.",1.0,2020-05-29 02:51:16,0.0
Anyone found a good 2FA app?,1.0,2020-05-29 08:59:55,0.0
Side note I have gapps and notifications both functioning fine.,1.0,2020-05-29 16:58:04,0.0
"Play market-----> aurora store, This is a complete replacement for the play market,[Download Aurora](https://4pda.ru/forum/index.php?showtopic=887569&view=findpost&p=70063507)
If someone wants to download it, then you need to register on this site, it is very popular in Russia",1.0,2020-06-01 00:19:22,0.0
how about an wallet app? any alternative for google pay?,1.0,2020-06-01 20:28:41,0.0
"Videos in this thread:

[Watch Playlist &#9654;](http://subtletv.com/_rgs4rxt?feature=playlist&nline=1)

VIDEO|COMMENT
-|-
[http://www.youtube.com/watch?v=Xwa15Vl9XHo](http://www.youtube.com/watch?v=Xwa15Vl9XHo)|[+2](https://www.reddit.com/r/Huawei/comments/gs4rxt/_/fs2xjgv?context=10#fs2xjgv) - pCloud looks cool:    Only has 10GB free though
[http://www.youtube.com/watch?v=NZOpi7w7RMM](http://www.youtube.com/watch?v=NZOpi7w7RMM)|[+2](https://www.reddit.com/r/Huawei/comments/gs4rxt/_/fs375ay?context=10#fs375ay) - I'll give it a go! Looks cool (sorry I love videos) lol:    Interestingly the Huawei browser does give you the option to block tracking too but I don't know if it does 13 like this Firefox Focus does! 👌👌
[http://www.youtube.com/watch?v=B2h6977_FYI](http://www.youtube.com/watch?v=B2h6977_FYI)|[+1](https://www.reddit.com/r/Huawei/comments/gs4rxt/_/fsicw1n?context=10#fsicw1n) - thanks for the feedback, yandex does look enticing! Anyone that wants some information around it check out this video, its abit old but shows whats the company stands for:
[http://www.youtube.com/watch?v=8sfJVGqM_5Q](http://www.youtube.com/watch?v=8sfJVGqM_5Q)|[+1](https://www.reddit.com/r/Huawei/comments/gs4rxt/_/fsnmwa5?context=10#fsnmwa5) - I got Google mobile services to work on my P40 Pro using this tutorial -
I'm a bot working hard to help Redditors find related videos to watch. I'll keep this updated as long as I can.
***
[Play All](http://subtletv.com/_rgs4rxt?feature=playlist&ftrlnk=1) | [Info](https://np.reddit.com/r/SubtleTV/wiki/mentioned_videos) | Get me on [Chrome](https://chrome.google.com/webstore/detail/mentioned-videos-for-redd/fiimkmdalmgffhibfdjnhljpnigcmohf) / [Firefox](https://addons.mozilla.org/en-US/firefox/addon/mentioned-videos-for-reddit)",1.0,2020-06-03 05:39:13,0.0
Does monzo work?,1.0,2020-06-08 23:19:48,0.0
"For the browser I'd recommend brave: https://brave.com/?ref=ana368 (use that link to support me as a content creator or just brave.com if you don't feel like supporting me)

Also a question: in countries where piracy is strongly penalized (I live in Germany) isn't Apptoide a crime? I honestly don't know, my question is legit since I don't want to get in trouble for an app.",1.0,2020-06-09 01:14:33,0.0
"That's pretty cool to know that both my banks work on these phones. Does anyone know (if you are allowed to discuss this on here) if you install Google services can you run any all from the playstore? 

Thanks",1.0,2020-06-10 11:08:29,0.0
"Soon google services will be available by default, as use harming them self by restricting Huawei",1.0,2020-06-12 23:09:25,0.0
Chrome works you can get it from shareit,1.0,2020-06-15 05:24:47,0.0
"Anything to replace Android Auto? Does the phone have MirrorLink?
I mean I just want to see Waze and control Deezer on my car screen.",1.0,2020-06-16 07:57:10,0.0
[https://consumer.huawei.com/en/mobileservices/huawei-wallet/](https://consumer.huawei.com/en/mobileservices/huawei-wallet/),1.0,2020-06-21 00:29:58,0.0
"A good read but I ask:

1. Has anybody tried the Nationwide Bank app?
2. GDrive still accessible from the browser and easily shortcutted if required?

Thanks",1.0,2020-06-21 10:11:42,0.0
Any work around to get Netflix to work?,1.0,2020-06-24 09:47:55,0.0
"Maverick for maps? Combined with OpenStreetMaps setting it's awesome, light and at once very functional. It's for those who prefer advanced apps, rather than the simple Google apps. It has functions like downloading selected squares of map, where it actually downloads the image of map, not like in Google maps where sometimes it isn't detailed. Track recording to GPX, compass, GPS sensor data, overlays e.g. hiking trails, cool system of waypoints and the entire maps works without any problems at just any device. Tested on multiple devices. I recommend it!",1.0,2020-06-29 19:18:09,0.0
Wear os?,1.0,2020-06-30 06:13:15,0.0
"I accidentally dropped my Honor 10 today and the screen got annihilated. I'd like to buy a Huawei p40 lite, but some apps are just completely vital to me, especially Spotify and Whatsapp. Do they work just as well, even though I've understood that you can't download them from Huawei's own app store? What about Snapchat? I also use a bank app, it's a very small bank so I highly doubt you could find it through AppGallery. Does anyone have any guesses if it could work if I transfer it from my old phone? It's a big expense so I don't want to make any mistakes... Thanks!",1.0,2020-07-05 04:38:45,0.0
Got any good recommendations for replacement for blackberry inbox app? It's a great app I have been using since mate 20 pro and would love to see it or similar alternative coz I'm thinking of getting p40 pro..,1.0,2020-07-06 05:57:16,0.0
"Just bought the p40 Pro, arrived today, absolutely love it. Didn't side load Google services coz can find most of apps from phone clone and then petal search . However a few apps broken /missing, ebay and gumtree UK, any suggestions? Or have to reply on Web link instead",1.0,2020-07-08 09:22:35,0.0
"Hi, I recently bought a P40 pro and I am happy with most of the apps that got transferred with phoneclone. However, I am using youtube vanced but I cannot sign in to my youtube account. Did you guys manage to do it?",1.0,2020-07-10 22:15:58,0.0
"Has anyone been able to test Android Wear? I have a Huawei Watch Jewel/Gen 1 that I wear daily, and am unsure if it'll work well on the P40 Pro. I contacted Huawei about it, however they were not of any help. ☹️",1.0,2020-07-13 05:55:20,0.0
how is Waze available? Waze is owed by Google now. Might be an older version that's no longer maintained?,1.0,2020-07-19 15:40:07,0.0
"Are any of the huawei apps free software(free as in freedom)? If not, I'd definitely recommend firefox over huawei browser, just for the fact that it is much more transparent.",1.0,2020-07-20 17:09:01,0.0
"Unlock bootloader, flash OpenGapps. Enjoy.",1.0,2020-07-22 21:29:22,0.0
About Google Photos alternative - there's app from Baidu called «一刻相册» which offers unlimited storage for photos,1.0,2020-07-23 10:30:46,0.0
"Has anybody tried the Google home app on a Google free Huawei???????

Does it work.....",1.0,2020-07-24 06:19:05,0.0
"If im not wrong, i think you can actually install google services on your phone? I installed google play youtube etc when i installed LineageOS on my phone and it worked fine, not sure if it can be done on huawei though",1.0,2020-07-24 21:02:19,0.0
"Files Go ----------- CCleaner.

Looking for an alternative for Google files go, app that help clean trash, large files and clear up space. 

Does anyone have other recommendations?",1.0,2020-07-27 08:34:40,0.0
Hello! How do you install MircoG for Youtube Vanced?,1.0,2020-07-28 05:29:19,0.0
Is the NBA app really not downloadable to the new OS of Huawei?,1.0,2020-08-02 17:16:04,0.0
Some alternative app to Google Keep? I used to share notes and lists w. my children. Now I can't.,1.0,2020-08-06 01:13:58,0.0
"Our company uses G Suite, so my Huawei phone is unusable in my work situation. Guess back to Samsung then",1.0,2020-08-06 17:28:54,0.0
I just installed google services and google play app store using this method: [https://www.youtube.com/watch?v=pXotMm47K2E](https://www.youtube.com/watch?v=pXotMm47K2E),1.0,2020-08-08 01:06:51,0.0
"Somebody can help? I've installed microG successfully and tried downloading uber, but it keeps asking me for google mobile services and therefore doesn't load any maps...help! :(",1.0,2020-08-11 04:33:30,0.0
"just got my p40 pro, seem a lots of crypto app doesn't work without GMS. like the popular binance and [crypto.com](https://crypto.com) app, both currently are not working. binance still can access in desktop mode but can only use a old phone to access [crypto.com](https://crypto.com) right now.",1.0,2020-08-13 06:37:38,0.0
Just apk android lmao,1.0,2020-08-18 07:14:58,0.0
Anyone able to log in to pinterest on a Huawei device without GMS using your Gmail account? Says I must use the Google button but cant seem to find it.,1.0,2020-08-19 06:10:07,0.0
"Hi, I have a question that I didn't think warranted its own thread. I want to purchase the Huawei Y9S. Does this mean I won't have access to Google Play services? Or is it only for new models? I don't care about software updates, I just want a durable phone.",1.0,2020-08-25 13:46:10,0.0
What about whatsapp Quora reddit ? Hsbc banking app? Amazon shipping app?,1.0,2020-08-29 22:19:16,0.0
"Petal Search will do all of those apart from HSBC, for that you either use phone clone from previous device or Aurora store.",1.0,2020-08-31 02:57:21,0.0
I turn off all motion control n split screen on my huawei mate 20x but still get the blue knuckle line... although it has no function but it's so irritating. how to turn it off?,1.0,2020-08-31 17:17:10,0.0
does anyone know if the app store for huawei has Kakaotalk and Band? I might be getting the P20 Pro but since google isn’t compatible i’d like to be sure before purchasing,1.0,2020-09-02 12:03:29,0.0
"Really insane, no matter how good Huawei phones are but because of this Google ban, these phones now are almost equivalent to just papers in terms of value. 

I really believe it's more of competition thing rather than security issues raised.",1.0,2020-09-05 03:31:51,0.0
But I can't use the Grab app.,1.0,2020-09-05 13:32:04,0.0
"US user here.  I have the Huawei Mediapad M5 8.4.  Being on an older device is starting to rub me the wrong way (currently still on Oero with EMUI 8) and the physical button isn't really helping in the perception.  The Huawei MediaPad M6 Turbo 8.4 caught my eye.  I wouldn't use the device for media consumption (maybe a game or two, but no YouTube or Netflix).  I might have been misinformed, but I thought you can still download and install gapps to access the Play App Store APK.  Am I mistaken?  Or are there like strings attached?",1.0,2020-09-06 01:22:52,0.0
https://www.huaweicentral.com/apple-and-googles-dual-monopoly-needs-to-be-ended-huawei-could-be-the-solution-huawei-cbg-president/,1.0,2020-09-14 02:00:25,0.0
Royal Bank (Canada) app works fine. Added it via phone clone. Mate 30 Pro.,1.0,2020-06-25 04:09:04,0.0
"I'll give it a go! Looks cool (sorry I love videos) lol: https://youtu.be/NZOpi7w7RMM

Interestingly the Huawei browser does give you the option to block tracking too but I don't know if it does 13 like this Firefox Focus does! 👌👌",3.0,2020-05-29 01:50:06,0.0
Have you been able to log into Chrome?,2.0,2020-06-24 20:02:20,0.0
"thanks for the feedback, yandex does look enticing! Anyone that wants some information around it check out this video, its abit old but shows whats the company stands for: https://www.youtube.com/watch?v=B2h6977_FYI",1.0,2020-06-01 20:53:04,0.0
"Yep, that is correct, just downloaded that too and it works perfectly 👌 thanks! - would it be helpful if I updated the original list?",6.0,2020-05-29 08:45:38,0.0
But Waze is google owned as well?,1.0,2020-08-27 23:36:48,0.0
"yep that is true, I've always been an app guy - call me old fashioned lol, but just using it like that theres not a massive difference, apart from when you turn it sideways , doesnt automatically take up the whole screen",2.0,2020-05-29 00:53:05,0.0
"Or just use one of the alternatives lbry, bitchute, bitube and there's a few others",1.0,2020-07-22 10:55:40,0.0
"Is protonmail and tutanota a generic email client or just for Gmail accounts?

Is pCloud free? Does it support automatic cloud backup?",2.0,2020-05-29 00:06:38,0.0
"Yeah it's abit crazy that America can be so oppressive in general but to the rest of the world too? - amazing.

From the people that have made the switch I've heard positive comments, they've said in a nutshell it's not as different as people make it out to be. 

When the alternatives are necessary they work really well and the only thing users seem to waiting for it Huawei Pay and 2 banks to code their app so it works when you phone clone it across or download it from aurora store (barclays and natwest) - in the UK anyway",1.0,2020-08-21 18:40:15,0.0
Yeah I know those methods are out there but thats not really what this thread is about. Thanks though,1.0,2020-06-03 09:37:33,0.0
does GPay work?,1.0,2020-06-15 01:28:01,0.0
What after that? Google Pay worked?,1.0,2020-07-12 05:53:38,0.0
"Yep no sync with the desktop which you'll always have two camps 1. It's more secure as it doesnt have  all these extra features it's pretty much locked down to your phone 2. Not as convenient if you want to pick up something you were reading onto your laptop without sending it via email etc. But I'm thinking of getting a Huawei Laptop as my Macbook is looking dated now. And you can put your phone screen onto the laptop so I'm hoping that would work?

The Huawei ID login was actually super slick... Like when you want to access your Google password and it asks you to verify your identity on you phone by fingerprint...or WhatsApp Web. - yep I'm a geek 😭 but the easiest way to do it is :
Swipe down on your homepage
Click on the button next to search just on the right of search bar and it auto opens up the QR scanner 💪

Maybe this will show you:
https://imgur.com/a/GkpQ0lz",4.0,2020-05-29 02:19:27,0.0
"So at the moment Google Pay/Huawei pay does not work... But Huawei pay is available in other countries... So its just a case of transferring that into the UK (or you country if another) that was almost a deal breaker for me... But I'm just going to carry around my card until it comes to the UK.

I'm also going to be including banking apps currently working along with the other apps in the OP. So stay tuned for that.

Google photos - best thing to do is download the data and reupload to another cloud service like Yandex - or you can leave them in the cloud for now and access photos via your Web browser and download separately as and when you need them rather than all at once.

Hope it helps! 👍",2.0,2020-06-01 05:49:44,0.0
Just pay with cash. Cash = freedom. Would be bad to lose it,1.0,2020-07-23 15:09:35,0.0
"Are you getting something went wrong. Please try again, I've just had the same error after 2 stage authentication with a text to my phone number",1.0,2020-07-20 23:29:37,0.0
"Yep 100% although I think Petal search is aiming to replace More Apps, have you tried both?",1.0,2020-07-20 23:24:31,0.0
"**I found links in your comment that were not hyperlinked:**

* [Mega.nz](https://Mega.nz)

*I did the honors for you.*

***

^[delete](https://www.reddit.com/message/compose?to=%2Fu%2FLinkifyBot&subject=delete%20fzdykqc&message=Click%20the%20send%20button%20to%20delete%20the%20false%20positive.) ^| ^[information](https://np.reddit.com/u/LinkifyBot/comments/gkkf7p) ^| ^<3",1.0,2020-07-27 21:06:14,0.0
Thanks! Will get these added asap. How you finding the device without Google other than that?,1.0,2020-08-23 05:47:21,0.0
Did you try yandex.disk?,1.0,2020-08-24 01:50:06,0.0
Haha they're definitely pushing in that direction 👌,1.0,2020-08-25 03:00:22,0.0
"Wow, just had a quick look into it and it never fails to surprise me the things we arent not aware of.... and half of Russia is probably using this like an everyday thing!   


The Yandex.Disk app looks cool! - not sure how I feel about my images on Russian servers like you say but I read back in the day when Google Photos first made an appearance that they have somewhere in the T&C's they can use the photos you upload there... which put me off!   


I did think about the S20 range but the Ultra's had some problems with build quality and I'm more of a photographer so the partnership with Leica had me at hello. I need to figure out what I'm doing with Banking apps though... I'll do some digging and report back",2.0,2020-05-29 02:55:25,0.0
"My banking apps work fine at the moment, as does nearly everything minus tap to pay which I don't use as a I have a tap to pay card I carry everywhere.",1.0,2020-05-29 17:00:45,0.0
You mentioned some streaming services don't work? Any in particular - I've downloaded Netflix and Prime Video (only two I use) and they work perfectly,1.0,2020-05-29 20:28:42,0.0
"Great shout! Onedrive does work but Huawei Cloud gives you 5GB free like Onedrive, anyway, shame its not more, think I might just bite the bullet with 50GB (its on promo at the moment for £8 for the year) - (Deego is tempting me with its 100GB... but the UI is abit glitchy and you want to feel semi secure that your data isnt bein misused etc)",1.0,2020-05-29 03:08:42,0.0
"I use andOTP, you can find it on F-Droid",2.0,2020-05-29 09:11:17,0.0
Which one do you usually use?,1.0,2020-05-29 09:02:34,0.0
"Still better if you can live without them, Google is not at all trustworthy.",1.0,2020-05-29 18:40:44,0.0
"Thanks my man, I'll be adding alternatives app stores tomorrow 👍",1.0,2020-06-03 09:46:18,0.0
"Yep, so the one I'm using at the moment (available from Huawei AppGallery) is ""StoCard"" - works flawlessly for store cards:
Costa
Go Outdoors
Ikea Family
Nandos
Screwfix
Starbucks
Tesco Clubcard
Toolstation
Wickes

And it has all the main ones for the UK atleast. Interestingly, there is a Contactless pay option, but when I try to set it up the app crashes lol, so I'd assume its using a Google API, so still no contactless, but im super happy about the store cards, and if you already had it on your previous phone, you can log in via email and they will import automatically",1.0,2020-06-01 21:08:20,0.0
"Yep, phone clone across/download through Aurora store",1.0,2020-06-09 01:05:52,0.0
"Yep Brave is super cool but they got caught up in abit of a scandal recently: https://uk.pcmag.com/suites/127285/brave-browser-caught-redirecting-users-through-affiliate-links.

I was using it before but now I'm going to stick to DDG (duckduckgo) or Huawei browser if I want to access my history etc. Its a shame because it was actually a cool browser.

With regards to Aptoide - I'm not legally qualified in my own country let along anyone elses, but if they weren't legit they probably wouldnt be bringing a case against Google - https://techcrunch.com/2019/06/04/aptoide-a-play-store-rival-cries-antitrust-foul-over-google-hiding-its-app/

But I'll leave you to make up your own mind :)",2.0,2020-06-09 01:45:09,0.0
"Maybe true, Google and Huawei have never stopped wanting to work together. It's just Trumps in the way with his conspiracy theories. But I like the direction Huawei is going moving away from. Google and hopefully you're data will be more secure and less tracking. Plus its better for customers to get over this now and form a ecosystem that isn't dependant on its success from Google, which may come and go.",2.0,2020-06-12 23:49:59,0.0
"That's cool, I'm already used to DDG and Huawei browser but would be interesting to have chrome in the portfolio too. I thought shareit was a app to transfer files between phones. How would I get chrome from it?",1.0,2020-06-15 23:30:32,0.0
"Nothing I've found yet, but using my new phone I was surprised to see the maps in Huawei health which I always thought was some Google integration but the fact its still showing me maps on a non Google device - I'd assume they've already got something in the pipeline plus there was talks of something called hicare which was Huawei's answer to android auto/apple car play.

Mirror link worked on P20 Pro handsets etc. But I don't have a head unit to test the feature with the newer handsets, if I come across one I will update here 👌",2.0,2020-06-16 20:20:50,0.0
"Only available in Russia, China, Singapore and Pakistan for now. I cannot wait till it comes to the UK",1.0,2020-06-21 04:14:51,0.0
"Ah yes, my omission - Nationwide works I've tested that one too 👌👌.

G drive is still accessible bvia the browser correct 💪💪 as you can also access the Huawei cloud on the browser you could switch your data on a pc or mobile. Google has a facility to download all your data in a zip file. 🤙",1.0,2020-06-21 18:38:42,0.0
"It works, but HD not yet. Try different app sources. Aurora store and petal search usually offer a working app. What have you tried?",1.0,2020-06-24 20:15:05,0.0
"Looks like a solid mapping solution for in depth analysis, not for me but I'll put it in. What would be the typical uses for something like this (only thing that springs to mind is some sort of swat team planning a raid lol...watching too much netflix clearly)

I dont want to put it as an alternative to Googlemaps and people get confused because it doesnt look like a navigation system, more a database of maps?",2.0,2020-06-30 06:55:23,0.0
Great suggestion,2.0,2020-07-11 19:41:56,0.0
"All the apps you mentioned will transfer across from your previous phone so long as you can still use it (WhatsApp and spotify, phone clone is the app that you use on both phones) 

which banking app is it?",1.0,2020-07-05 09:53:21,0.0
Looks like it's working to. I downloaded Blackberry services and inbox through Petal Search. I dont have a blackberry account but I tried email and it allowed me through the process 👍,1.0,2020-07-06 08:30:43,0.0
