Reply,Upvote,Time,Key
naaah,1.0,2020-08-29 04:46:40,534.0
I wouldn't worry tbh as they will still give you updates,1.0,2020-08-29 05:58:07,534.0
" says phones after May 2019. I stand corrected. My only nova5t will likely be another piece of junk if google decides to block it

Quite concerned, since I used nova 7i for 2 days, tried to live without Google, but Google has gotten me very hard into their ecosystem. I sold off the phone as it is pretty lame without Google Framework and GMS.",1.0,2020-08-29 07:53:13,534.0
ithink it will come back someday,1.0,2020-08-29 08:44:32,534.0
huawei should open bootloader then the problem with google solves itself,1.0,2020-08-29 08:45:40,534.0
"Oh thanks
So there's not gona be an update or anything where Google wouldn't work",0.0,2020-08-29 04:46:57,534.0
You'd run into issues with apps requiring safetynet.,1.0,2020-08-29 08:55:38,534.0
If they've released up to date kernel sources you could patch it to pass safety net. Iirc you just need to target verified boot state and a few additional safety net related flags from /proc/cmdline,1.0,2020-08-30 12:14:10,534.0
"Seems I like you have been using other chargers with different charging rates. This can severely damage the battery because their formulated for different applications.

You might try clearing Cache and partition cache, but that just checks if it is a software problem.",1.0,2020-08-29 04:36:37,535.0
Are you using the wire that came with the phone?,1.0,2020-08-29 04:49:21,535.0
I always thought that the phone itself decides what amperage it needs. Sure I have used chargers with Quick-Charge or old USB chargers which only support 1 A... But is it really possible that the battery will be damaged? Isnt the battery charge controller making sure that the battery is not charged with too high amperage?,1.0,2020-08-29 05:40:22,535.0
"Good point, the connectors are heavy-duty for the Wattage, and the strands of wire in the cable is much thicker too.",1.0,2020-08-29 05:14:04,535.0
"Yes, the original Huawei Cable and the Huawei Charger.",1.0,2020-08-29 05:31:45,535.0
"As far as I know, chargers deliver at a set Wattage (you can cook your battery overcharging it too).",1.0,2020-08-29 06:08:15,535.0
"Ask Huawei support in an email about all this, if you want to know.",1.0,2020-08-29 06:09:47,535.0
"Introducing /r/Honor, with HONOR help and official giveaways! Hey there Friend, thanks for your attention on HONOR products. Feel free to Post News, Submit photos, Start discussions, Ask for help, and Participate in the Giveaways.!

*I am a bot, and this action was performed automatically. Please [contact the moderators of this subreddit](/message/compose/?to=/r/Huawei) if you have any questions or concerns.*",1.0,2020-08-29 03:51:38,536.0
"Try running Smart Diagnosis in your Support app.

Have you tried Factory reset?",1.0,2020-08-29 04:40:11,536.0
"all 3 phones come as unlocked, I've never had to unlock a phone and I've been with 3 years",1.0,2020-08-29 02:23:37,537.0
"I got scammed by this guy, who sold be an phone that was locked to three. The phone is an iPhone 7 plus and that's still locked",1.0,2020-09-03 02:01:55,537.0
Yea very strange as my router Huawei 5G router only a few months old and still locked to Three. Huawei Simlockcode 16 digits needed.,1.0,2020-09-03 02:15:50,537.0
"I'm in the same boat. After poking around it actually says it is permanently locked with zero attempts left to unlock it, so even getting a code wouldn't work. I was wondering if you can flash it / root it somehow… anyone? Not much help around for this device yet. Three may still want it back, too - technically it's only rented from them, so bricking it might not be the best idea…",1.0,2020-09-09 02:28:13,537.0
Tried to unlock the router with 3rd party but no luck they could not unlock it for some reason it apparently locked to three UK. Ibought my router off ebay and the seller said it was from three. Be interested to know if any other ways to unlock it for EE as i would need to find a router that would work with that network.,1.0,2020-09-09 09:17:02,537.0
https://www.google.com/amp/s/www.huaweicentral.com/celia-voice-assistant-rollout-for-huawei-p30-and-mate-20-devices-unconfirmed/amp/,2.0,2020-08-28 23:43:34,538.0
Head over to system and updates then languages and input and change it to English  and region as United Kingdom or any language or region where Celia is supported then press and hold power button for 3sec it should ask permission and you should have it,1.0,2020-08-28 18:25:37,538.0
Country and Carrier?,1.0,2020-08-28 18:55:41,538.0
"If you bought your phone in America, it won't work until it is released in an update there. If didn't, you'll have to wait until you return to the UK, remove the American Sim, put the UK one in slot 1, change all your location settings to UK, and pulling eRecovery is your best shot.",0.0,2020-08-28 19:29:19,538.0
"Ahhh, thank you!",1.0,2020-08-29 03:04:53,538.0
"Nothing, just Google...",1.0,2020-08-28 19:09:24,538.0
US on SIM1 T-Mobile + SIM2 Vodafone (UK),1.0,2020-08-28 19:10:18,538.0
"I bought it from Amazon while in the states—I live here but wanted this phone. But I think the region for this phone is EU/UK, hence the UK SIM I bought. I got it for the updates. So for now I wait for Celia",1.0,2020-08-28 20:03:11,538.0
Celia isn't in the UK yet,1.0,2020-09-04 08:35:22,538.0
"Well search in the settings search bar ""language and input""",1.0,2020-08-28 23:54:52,538.0
"Hmm... Thank you, I stand corrected. Also after I posted that, I did have the passing thought that the chip might not be able to handle AI.",1.0,2020-09-04 10:55:12,538.0
That's how I got to it but didn't see any changes afterwards even after a few restarts. I'll keep it like that for a while,1.0,2020-08-29 03:04:11,538.0
i have a mate 20 lite if that helps,1.0,2020-08-29 00:44:50,539.0
"buy a replacement battery if you think that one is dead

&#x200B;

[https://www.amazon.co.uk/Huawei-ORIGINAL-Battery-Handyakku-HB3543B4EBW/dp/B00O7JI0DY](https://www.amazon.co.uk/Huawei-ORIGINAL-Battery-Handyakku-HB3543B4EBW/dp/B00O7JI0DY)

&#x200B;

(search for HB3543B4EBW to find that battery)",5.0,2020-08-28 19:02:45,540.0
"Buy a replacement battery, this one can be around 6 years old and if it doesn't work anymore I wouldn't play with it like that and keep it alive via constant charging.

Just to be safe imo.",2.0,2020-08-29 02:48:21,540.0
Have you tried using a different charging port & cable?,1.0,2020-08-28 18:58:26,540.0
[deleted],0.0,2020-08-28 18:35:14,540.0
" Thank you Soo much for your help, can't wait to bring it back to life",1.0,2020-08-29 08:05:03,540.0
"Yeah gonna get one soon, thank you for your reply, stay safe!!",1.0,2020-08-29 08:08:39,540.0
Yes I did and unfortunately it's the battery,0.0,2020-08-29 08:06:27,540.0
I do have a new phone but then I can't let go of this,2.0,2020-08-28 18:39:04,540.0
"Screw the moon, look at the airplane on the left",3.0,2020-08-28 02:04:01,542.0
Damn! I didn't seen that 👌very nice eye dear 🔭,2.0,2020-08-28 05:56:52,542.0
"Apps can't be moved to an SD card on most Android phones. Only pure Android phones like Pixels and some Nokia phones allow you to do it. The card is for files like pictures, videos and other things that are not required for an app to work.

Some phones still show you an option to move an app to the SD card but it doesn't actually move the app itself. It only moves the assets the app uses (e.g. icons, background images, etc.).

An app could get an update which prevents its assets from being moved which is what I would guess has happened in your case.",2.0,2020-08-28 20:10:28,543.0
"I'm confused as I get an option on honor 7, but not on the 7s. I have an sd card with over 22 gigs of space left",1.0,2020-08-28 20:05:43,543.0
"Introducing /r/Honor, with HONOR help and official giveaways! Hey there Friend, thanks for your attention on HONOR products. Feel free to Post News, Submit photos, Start discussions, Ask for help, and Participate in the Giveaways.!

*I am a bot, and this action was performed automatically. Please [contact the moderators of this subreddit](/message/compose/?to=/r/Huawei) if you have any questions or concerns.*",0.0,2020-08-28 20:04:28,543.0
Thanks,1.0,2020-08-28 22:58:40,543.0
"I have used my Huawei Mate 10 Pro with a cheap USB-C to Jack adaptor, so I guess it is a a passive connector.",2.0,2020-08-28 20:19:13,544.0
I guess I would go for passive. The phone have an Internal DAC anyways and the passive one is way cheaper.,1.0,2020-08-28 20:20:23,544.0
"Depends what headphones are you going to use, I don't think cheap nova's 5t dac can compete to the one used in LG v50.",2.0,2020-08-28 20:29:47,544.0
I primarily use my Awei Z1 Dual Driver Earphones. I don't think if an Active DAC would help.,1.0,2020-08-28 20:31:25,544.0
Just buy standard USBc to jack adapter. With earphones you use you would not use full potential of a high spec dac. Also good dacs are 50£/$ plus. Try Sony EC260.,1.0,2020-08-28 23:25:17,544.0
"I think you need to charge the battery. If the voltage is below a certain level, it will not boot, or if it does it will shutdown.",1.0,2020-08-29 01:27:53,545.0
Hi did you manage to get your Mate 20 Pro working? I’ve just ordered a replacement battery for mine but I am apprehensive to open the phone up and change the battery as I am reading people are having a boot loop issue if they change the phone’s battery?,1.0,2020-09-08 01:37:20,545.0
"No I did not fix it yet, still desperately trying...",1.0,2020-09-08 03:04:23,545.0
"Absolutely no idea what power genie is & that isn't what's controlling the control of apps. 


If you don't want an app to be killed in the background you need to go to settings > apps > Name of App e.g. Reddit > power usage details > app launch. From there you can select what you do & don't want to happen.


Make sure you also turn off other general battery optimisation settings like power saving modes as well.",1.0,2020-08-28 18:54:23,546.0
"See how to disable it in here
https://dontkillmyapp.com/huawei

You need to use adb on a pc to do it.",1.0,2020-08-28 18:59:35,546.0
"Until the Bootloader codes are released, any attempt could Brick your phone.",1.0,2020-08-28 19:18:13,546.0
Personally I've never had an issue with apps being killed after configuring ' app launch ' settings to my likings.,1.0,2020-08-29 02:50:04,546.0
Power Genie is the software used to kill apps in the background and keep others open,1.0,2020-09-04 08:36:43,546.0
Is it safe to use an adb software then uninstall it?,0.0,2020-08-28 19:29:32,546.0
"If you mess with God, you might face his Wrath.

That said, before you mess around, get familiar with eRecovery in the Honor support page's.",1.0,2020-08-28 19:47:43,546.0
Yeah I think that's probably too slow to enjoy. Maybe twice as fast would be better. I guess it depends on your subject.,3.0,2020-08-27 18:34:29,548.0
"Quick tip, google slow motion interpolation :)

You can check out there why objects that still move fast in slow mo look fucked up and why it s not true 960 fps",3.0,2020-08-27 17:30:36,548.0
I managed to figure out the culprit. It's Microsoft SwiftKey. I replaced with with another app and no more problems. Hope this helps other people with similar issue.,1.0,2020-08-28 23:06:55,549.0
"In the UK, I found the O2 5G coverage map to be untrue. But my phone says it does connect, way out of range too (11 up + 18 down). I'm glad you pointed this out, because now that makes sense too.",3.0,2020-08-27 22:16:28,550.0
I live in Turkey and we have 4.5G here. I avarage about 200Mbps.,3.0,2020-08-28 02:03:17,550.0
Greetings from Germa##!/((&   \[connection lost\],1.0,2020-08-28 07:04:09,550.0
"AT&T has 5Ge (evolution) labelling for its newer gen LTE networks, (resulting in iPHONES actually getting a 5g logo), since they are decidedly 4G, they are being sued for false advertising...",1.0,2020-08-28 07:40:49,550.0
The only true 5G is Huawei. Every other company only have fake 5G,1.0,2020-08-28 04:43:43,550.0
Ericsson also.,1.0,2020-08-28 07:51:54,550.0
"Apps are getting larger with every update, especially game Apps. If you are a heavy Gamer yes, if not, it is overkill.",2.0,2020-08-28 19:39:04,551.0
"8gb of course, anyone that say ""it doesn't matter"" don't know shit.",2.0,2020-08-29 03:54:50,551.0
"Honestly the RAM doesn't really matter. 8gb or RAM is overkill even if you have multiple tasks running in the background. I have a Nova 7i with 8gb or ram and even when I'm playing demanding games, I'm only topping 4gb or RAM usage. And honestly, even if you wanna get that for future proofing, I don't think that there will be an app in the near future that will need you to use 8gb if RAM

I guess it then comes down to memory space. If you're one to keep a lot of videos and pics (which are the main things that will be using up your memory space) then go for the 256g cause  Huawei phones doesn't have normal SD card slots and you have to get the ones that they developed to fit in the slot. But if you know that you'll delete most of them videos and pics then no point overkilling the memory space too

Just to put into perspective

256gb =711,111 photos in 4K resolution


But since you say you use it for photos, you might need the extra storage so I'd say go for the 256gb one",1.0,2020-08-28 13:52:48,551.0
"Well i do play a few games at a time, but my last phone (which broke a few days ago) had 16 gb and well it was a nightmare so i wanna go with something having more space + something that i will use for a long time(as this will be the first phone that i will buy with my own money). And tbh im a gamer just trying not to play as much as I did before because of school.",1.0,2020-08-29 05:37:03,551.0
Then can you tell me what's the difference between 8gb ram and 6gb ram?,1.0,2020-08-29 05:32:19,551.0
I just checked the price of the nano memory card and for that price I can get the 8gb ram version instead of buying only the space. I do think that 256gb and 8gb ram are overkill but at the same time im buying the phone with the intention to use it for a least 5 years (hopefully more if nothing happens) so i do think for the price i was offered the best thing to do is buy the 8gb one. + I didnt knew it actually used a different sd card than mine so thanks that helped a lot.,2.0,2020-08-28 18:34:17,551.0
You get 2 more gigs.,1.0,2020-08-29 06:46:24,551.0
Ahah yeah thats for sure but like how does it affects the phone? Is it a big change or something small?,1.0,2020-08-29 07:03:15,551.0
Future proof.,1.0,2020-08-29 07:03:39,551.0
Aha i see well its kinda obvious but still tnx.,1.0,2020-08-29 07:53:00,551.0
"I guess what he meant to say was that you should always go for 8GB or higher, whichever options are available. Pick higher. The cost difference isn't a leap, and let me work out some math for u:

1GB-2GB goes into Android today so that it functions well and buttery. It could increase depending on your usage of functionalities like Bluetooth, NFC, WiFi, Gyroscope, Accelerometer, 4G x 2, VoLTE. 

Now you're left with 4GB, and chrome takes another 2GB away with 10 Tabs and heavy duty websites that requires GPU processing.

Not much left? 2GB for background apps such as messaging tools. Anything left is buffer. But you're not giving your phone any breathing space for future proofing.",1.0,2020-08-29 07:59:03,551.0
"I see and tbh THANK YOU like seriously I needed an answer like this one, just math and explanation of why. Well then im going for 8gb ram and thats that. I mean i still have time to check out the interface and everything before i buy but overall it seems like I have made my mind up about it.",1.0,2020-08-29 08:53:42,551.0
"Well perhaps as you get less conscious with money (perhaps age matters), these are little decisions that shouldn't take too much of your time. It's only that small gap and price to pay. Just shoot for the skies.

Great work on your choice. P30 Pro is a no-brainer choice. Enjoy the buttery interface. YouTube has many reviews to help make your mind.",1.0,2020-08-29 09:20:37,551.0
"Wait i got a little confused. Are you saying P30 Pro is good(""Great work on your choice"") or not(""P30 Pro is a no-brainer choice"").",1.0,2020-08-29 09:27:31,551.0
Great on your choice.,2.0,2020-08-29 10:13:04,551.0
Hah okay thank you!,1.0,2020-08-30 00:23:11,551.0
"I can do it just fine over wifi, why are you using a cable ?",1.0,2020-08-28 16:42:22,552.0
Are you talking about Desktop share under Huawei share? Where you can access your phones files through windows file explorer?,1.0,2020-08-28 21:51:55,552.0
File commander and ES file explorer allow you to send/receive files via wifi using the app and the computer’s browser. Both apps are in the AppGallery,1.0,2020-08-30 23:25:13,552.0
"Because most desktops do not have wifi incorporated. Only a few, very expensive, motherboards have wifi.",1.0,2020-08-28 23:10:04,552.0
I want to do it without a cable though.,1.0,2020-08-28 23:10:44,552.0
"As long as you are on the same network works fine, the PC con be wired with cable",1.0,2020-08-29 01:24:45,552.0
"I had the Mate S, then the Mate 9 & 10 , now i own the Mate 20 (not the pro) and i am very happy with the phone",2.0,2020-08-28 16:05:57,554.0
Works for my huawei m6 10.4,1.0,2020-08-28 20:36:20,559.0
"Introducing /r/Honor, with HONOR help and official giveaways! Hey there Friend, thanks for your attention on HONOR products. Feel free to Post News, Submit photos, Start discussions, Ask for help, and Participate in the Giveaways.!

*I am a bot, and this action was performed automatically. Please [contact the moderators of this subreddit](/message/compose/?to=/r/Huawei) if you have any questions or concerns.*",1.0,2020-08-28 02:04:09,560.0
"Is there a smart diagnostic program in the support app, to help you with that problem?

Have you tried to set it up the finger print feature again?

Try clearing Cache. Then clearing Partion Cache.

Factory reset? 

Worst case... The technician could have failed to assemble it correctly ( not hooking up a connector).",1.0,2020-08-28 07:57:15,562.0
"Small. Compact, beautiful and has the speed to match",1.0,2020-08-28 08:05:33,564.0
Go to the Support App and run Smart Diagnosis.?,1.0,2020-08-28 06:08:54,565.0
"My mate 20 pro is running like the first day I took it out the box, never freezes on anything and I also use Chrome. I've had my phone same amount of time also I can update in January. Could it be a third party app installed not sure 🤷🏿‍♂️",2.0,2020-08-28 04:57:06,566.0
Bro its a chrome problem i switched my browser now it doesnt happen. It is some Bug thats affecting other androids as well,1.0,2020-08-28 05:46:51,566.0
Chrome is the worst for your privacy too. Try the duckduckgo app.,1.0,2020-08-28 06:11:35,566.0
"Introducing /r/Honor, with HONOR help and official giveaways! Hey there Friend, thanks for your attention on HONOR products. Feel free to Post News, Submit photos, Start discussions, Ask for help, and Participate in the Giveaways.!

*I am a bot, and this action was performed automatically. Please [contact the moderators of this subreddit](/message/compose/?to=/r/Huawei) if you have any questions or concerns.*",1.0,2020-08-27 22:13:01,567.0
Did you do this through wifi?,1.0,2020-08-27 23:29:05,567.0
"No there is no ROM on this device because it was deleted through TWRP.
So tried to install Stock-ROM through EMUI/Huawei eRecovery from dload folder but there is not ''Install'' option.

Tried to flash every 3 zip files through TWRP but there are errors.",1.0,2020-08-27 23:51:52,567.0
[see this... ](https://rootmydevice.com/tools/download-twrp-recovery/),1.0,2020-08-27 23:56:23,567.0
"Holy shit that's so good, wonder if my nova 5t can take macros like these, absolutely beautiful",7.0,2020-08-27 08:37:05,568.0
Hello there! Greetings from P30pro!,2.0,2020-08-27 13:03:11,568.0
"Damn, dragonflies be using mate 20 pro",2.0,2020-08-27 17:33:44,568.0
"Do you know how can I make a ""super macro"" with my P40 Pro Plus?",1.0,2020-08-28 03:13:11,568.0
I was extremely lucky that it stayed still long enough for me to take the shots!,3.0,2020-08-27 10:20:59,568.0
Ayy id be nervous with that on my hand tbh xD,4.0,2020-08-27 12:07:28,568.0
Hope so 🤩,1.0,2020-08-27 21:41:42,570.0
i have those animations on my p40 pro so this is not new to me....,1.0,2020-08-28 05:33:02,570.0
The night mode only works properly if you keep your phone still. Normally holding it in your hands is not enough. You need to support your hands against something or use a tripod.,4.0,2020-08-27 21:21:37,571.0
"Short explanation 

https://consumer.huawei.com/en/community/details/topicId_47891/",2.0,2020-08-27 21:39:52,571.0
I've noticed that too op.,2.0,2020-08-27 21:39:00,571.0
I get your point.,1.0,2020-08-27 23:29:42,571.0
I think exactly the same question with my P30 Pro.,1.0,2020-08-28 01:08:08,571.0
"Open the following. Settings/Mobile network/Data usage/ here click on MORE next to ""Data usage this month"" and after this on the top you can select Mobile data or WiFi.
Let me know if something is not clear.",2.0,2020-08-28 10:23:59,572.0
Amazing!! Got my p30 pro yesterday!!,3.0,2020-08-26 23:30:09,573.0
P30 Pro is such a great phone. Have mine for 10 months now and I couldn't be happier. Can't believe people actually tought iPhone 11 Pro Max had better camera than P30 Pro. Such a limited camera compared to P30 Pro's,2.0,2020-08-27 05:01:38,573.0
Anybody have problems with dull colours on the camera on the p30 pro? Iv compared mine to my partners mate 20 pro and the photos are morw or less the same but the mates colors are alot brighter. Considering a factory reset,1.0,2020-08-27 07:10:33,573.0
"Yeah, right now they're showing us who really is in control.",1.0,2020-08-26 21:22:55,573.0
I hope you will be at least that satisfied with it as me 🙂,2.0,2020-08-26 23:37:28,573.0
"Try to check the photos from both phones on a 3rd device for example a PC and than you can compare.
Maybe it's just the display of the phone 🙂",1.0,2020-08-27 07:20:44,573.0
"The real innovation OS is happening in Android, that is freely owned by everyone. The expression's of this in Google, Samsung, Huawei, are just Skins.

The problem with Google is Google Play, a 30% cut for playing the Banker.",1.0,2020-08-27 21:45:43,574.0
"When it comes to phones, yes. Probably Huawei has beaten the competition into a corner, hands down the best bang for the buck. Even if you don’t go for their flagship, you’re better off than with a similarly priced model from another manufacturer.

The whole rhetoric isn’t about phones though. They make a lot more equipment than that. It’s _that_ part that worries governments. Allegedly.

The basic idea is you don’t want your data ending up somewhere else, or getting a hardware with built in backdoor. One you don’t know about or can’t do anything about.

Not your data as an individual, think military applications, a router in a datacenter housing tens or hundreds of businesses, and so on.

Nobody cares about the simpleton, Google, Facebook, and everyone else sees us as merchandise. The phone segment of Huawei’s business will probably be just a collateral victim.

https://www.cfr.org/backgrounder/huawei-chinas-controversial-tech-giant

It also doesn’t help that as a Chinese business you can’t really exist without the Chinese government approval (and if they want you to do something, you probably can’t refuse), that China has been for years copying and stealing IP (people don’t trust them), that they’re accused of a lot of bad things (see Hong Kong, uighur genocide, mass surveillance, crass incompetence when dealing with Covid), that they have an aggressive external policy, that they somehow managed to hijack global internet traffic for a few hours some years ago, and so on.

PS: this forum doesn’t like this kind of explanation, but unfortunately it’s more related to geopolitics than phones.",1.0,2020-08-27 22:00:47,574.0
"~~Android isn’t freely owned. Google is licensing manufacturers to use it. They pay Google a fee for each device.~~

This was wrong, the OS is free, but the GMS is not.

https://www.huaweicentral.com/what-is-google-mobile-services-gms-and-why-huawei-requires-its-license/

https://www.businessinsider.com/how-google-controls-androids-open-source-software-2014-1",2.0,2020-08-27 22:31:38,574.0
"I love how Huawei building their own ""story"", HarmonyOS is badass, needs a little more work but in few years he will be done and perfect OS.",1.0,2020-08-27 21:53:40,574.0
"I was not that into Huawei vs Google storyline, but i feel Huawei is more stable at some point of mobiles and systems. The main thing which bothers me is not able to unlock bootloader but after thinking i think that was smart from their side, since evryone bricks phone and blame company. But let's see how this all huawei and google thing go.",1.0,2020-08-27 22:03:20,574.0
"Whoa Cowboy, the last genocide in China was done by the Japanese during WW2. The Uighurs story in the mainstream media is totally built on the interviews with 8 (and yes I said that right) 8 families in that region. This is also the area where the railroads move out of China to the West, for the Belt and Road Initiative, do you see my point?",1.0,2020-08-28 00:20:38,574.0
"Opps, I meant open-source.",2.0,2020-08-27 22:42:42,574.0
